[
  {
    "id": "ENT-TOY-001",
    "domain_id": "toys_playground",
    "subtopic_id": "classic_toys",
    "name": "Teddy Bear",
    "language": "en",
    "audience_rating": "kids",
    "aliases": [
      "Teddy",
      "Stuffed Bear",
      "Plush Bear"
    ],
    "difficulty": 1,
    "visual_anchor": "A soft golden-brown teddy bear with a red bow tie sitting on a cozy patterned quilt beside a bedside lamp, warm bedtime glow, 9:16 vertical shot.",
    "core_traits": [
      "Soft, cuddly toy many kids hug at bedtime",
      "Usually stuffed and covered in fuzzy fabric",
      "Shaped like a friendly round-eared forest animal",
      "Named after a United States president's nickname"
    ],
    "distractor_pool": [
      "Rag Doll",
      "Stuffed Bunny",
      "Sock Monkey",
      "Plush Elephant",
      "Hand Puppet"
    ],
    "facts_and_myths": [
      {
        "claim": "The teddy bear is named after President Theodore Roosevelt.",
        "verdict": "fact",
        "explanation": "Roosevelt's nickname was Teddy, and a 1902 cartoon about him and a bear inspired toymakers.",
        "fun_fact": "Around the same time, a German toy company called Steiff also began making stuffed toy bears."
      },
      {
        "claim": "Teddy bears are named after a famous real bear called Teddy.",
        "verdict": "myth",
        "explanation": "The name comes from President Theodore Roosevelt, not from any real bear.",
        "fun_fact": "Teddy bears became so popular in the early 1900s that they were sold all over the world."
      }
    ],
    "versus_candidates": [
      "Rag Doll",
      "Building Blocks",
      "Toy Train Set"
    ]
  },
  {
    "id": "ENT-TOY-002",
    "domain_id": "toys_playground",
    "subtopic_id": "classic_toys",
    "name": "Yo-Yo",
    "language": "en",
    "audience_rating": "kids",
    "aliases": [
      "Yoyo"
    ],
    "difficulty": 1,
    "visual_anchor": "A shiny bright blue yo-yo spinning at the end of its string below a child's hand, sunny park background softly blurred, 9:16 vertical shot.",
    "core_traits": [
      "Small toy that goes down and comes back up",
      "Made of two discs joined by a short axle",
      "A string is looped around the middle and tied to your finger",
      "Famous tricks include Walk the Dog and Around the World"
    ],
    "distractor_pool": [
      "Spinning Top",
      "Kendama",
      "Diabolo",
      "Paddle Ball",
      "Fidget Spinner"
    ],
    "facts_and_myths": [
      {
        "claim": "A yo-yo has been played with in outer space.",
        "verdict": "fact",
        "explanation": "In 1985, astronauts took a yo-yo on the Space Shuttle to show how toys behave without gravity.",
        "fun_fact": "In space, a yo-yo will not sleep at the bottom of its string the way it does on Earth."
      },
      {
        "claim": "The yo-yo was first invented in the 1900s.",
        "verdict": "myth",
        "explanation": "Yo-yo-like toys were played with in ancient Greece more than two thousand years ago.",
        "fun_fact": "Old Greek vases show children playing with disc toys on strings."
      }
    ],
    "versus_candidates": [
      "Spinning Top",
      "Kendama",
      "Slinky"
    ]
  },
  {
    "id": "ENT-TOY-003",
    "domain_id": "toys_playground",
    "subtopic_id": "classic_toys",
    "name": "Spinning Top",
    "language": "en",
    "audience_rating": "kids",
    "aliases": [
      "Top",
      "Whirligig"
    ],
    "difficulty": 1,
    "visual_anchor": "A colorful striped wooden spinning top twirling on a polished wooden floor, motion swirls of red, yellow and blue, 9:16 vertical shot.",
    "core_traits": [
      "Toy that twirls around and around on one point",
      "Often shaped like a cone or an upside-down pear",
      "You twist it with your fingers or pull a string to start it",
      "Wobbles and topples over when it slows down"
    ],
    "distractor_pool": [
      "Yo-Yo",
      "Dreidel",
      "Gyroscope",
      "Fidget Spinner",
      "Pinwheel"
    ],
    "facts_and_myths": [
      {
        "claim": "Spinning tops are one of the oldest toys in the world.",
        "verdict": "fact",
        "explanation": "Archaeologists have found ancient tops made of clay and wood in many parts of the world.",
        "fun_fact": "A dreidel, spun during Hanukkah celebrations, is a kind of spinning top with four sides."
      },
      {
        "claim": "A top falls over sooner the faster it spins.",
        "verdict": "myth",
        "explanation": "Fast spinning actually keeps a top upright. It wobbles and falls as it slows down.",
        "fun_fact": "The same spinning balance helps a bicycle wheel stay upright while rolling."
      }
    ],
    "versus_candidates": [
      "Yo-Yo",
      "Marbles",
      "Kaleidoscope"
    ]
  },
  {
    "id": "ENT-TOY-004",
    "domain_id": "toys_playground",
    "subtopic_id": "classic_toys",
    "name": "Slinky",
    "language": "en",
    "audience_rating": "kids",
    "aliases": [
      "Spring Toy",
      "Walking Spring"
    ],
    "difficulty": 2,
    "visual_anchor": "A shiny metal coil spring toy stepping down a set of carpeted stairs in a graceful arch, bright cheerful living room, 9:16 vertical shot.",
    "core_traits": [
      "Stretchy toy that can step down stairs by itself",
      "Made from one long coiled band of metal or plastic",
      "Makes a soft slinking sound when you pass it hand to hand",
      "Invented in the 1940s after an engineer saw a spring fall"
    ],
    "distractor_pool": [
      "Yo-Yo",
      "Spinning Top",
      "Jack-in-the-Box",
      "Wind-Up Toy",
      "Pogo Stick"
    ],
    "facts_and_myths": [
      {
        "claim": "A Slinky can walk down stairs all by itself.",
        "verdict": "fact",
        "explanation": "Once you tip it over the first step, gravity and the coil's springiness keep it flipping down.",
        "fun_fact": "The Slinky is the official state toy of Pennsylvania."
      },
      {
        "claim": "When you drop a hanging Slinky, the bottom starts falling right away.",
        "verdict": "myth",
        "explanation": "The bottom seems to hover for a moment until the collapsing top coils reach it.",
        "fun_fact": "Slow-motion cameras made this floating Slinky trick famous with science fans."
      }
    ],
    "versus_candidates": [
      "Yo-Yo",
      "Jack-in-the-Box",
      "Wind-Up Toy"
    ]
  },
  {
    "id": "ENT-TOY-005",
    "domain_id": "toys_playground",
    "subtopic_id": "classic_toys",
    "name": "Kaleidoscope",
    "language": "en",
    "audience_rating": "kids",
    "aliases": [],
    "difficulty": 2,
    "visual_anchor": "A child holding a painted tube up to one eye while a bright snowflake-like pattern of colored jewels glows in a circle beside them, 9:16 vertical shot.",
    "core_traits": [
      "Tube toy you look into and turn",
      "Shows changing patterns of bright colors",
      "Uses mirrors inside to repeat shapes like a snowflake",
      "Invented by a Scottish scientist in the 1810s"
    ],
    "distractor_pool": [
      "Telescope",
      "Periscope",
      "Magnifying Glass",
      "Prism",
      "View-Master"
    ],
    "facts_and_myths": [
      {
        "claim": "The kaleidoscope was invented by Scottish scientist David Brewster.",
        "verdict": "fact",
        "explanation": "Brewster created it in 1816 while studying how light reflects, and it quickly became a hit.",
        "fun_fact": "The name comes from Greek words meaning beautiful shape to look at."
      },
      {
        "claim": "The patterns inside a kaleidoscope are painted pictures.",
        "verdict": "myth",
        "explanation": "Loose beads or glass bits are reflected by angled mirrors, creating new patterns each turn.",
        "fun_fact": "You almost never see the exact same kaleidoscope pattern twice."
      }
    ],
    "versus_candidates": [
      "Telescope",
      "Spinning Top",
      "Etch A Sketch"
    ]
  },
  {
    "id": "ENT-TOY-006",
    "domain_id": "toys_playground",
    "subtopic_id": "classic_toys",
    "name": "Jack-in-the-Box",
    "language": "en",
    "audience_rating": "kids",
    "aliases": [
      "Jack in the Box",
      "Pop-Up Box"
    ],
    "difficulty": 2,
    "visual_anchor": "A smiling clown puppet with a striped hat popping up on a spring from a colorful painted box, confetti in the air, playful nursery, 9:16 vertical shot.",
    "core_traits": [
      "A box toy with a surprise inside",
      "You turn a crank on the side and music plays",
      "At the end of the song, the lid flies open",
      "A smiling figure on a spring pops out"
    ],
    "distractor_pool": [
      "Music Box",
      "Wind-Up Toy",
      "Slinky",
      "Hand Puppet",
      "Pop-Up Book"
    ],
    "facts_and_myths": [
      {
        "claim": "Many jack-in-the-boxes play the song Pop Goes the Weasel.",
        "verdict": "fact",
        "explanation": "The figure usually jumps out right on the word pop at the end of the tune.",
        "fun_fact": "The pop-out figure is often a clown or jester."
      },
      {
        "claim": "A jack-in-the-box needs batteries to make its figure pop out.",
        "verdict": "myth",
        "explanation": "A squeezed spring inside the box pushes the figure out when the latch releases.",
        "fun_fact": "Jack-in-the-box toys have been surprising kids for hundreds of years."
      }
    ],
    "versus_candidates": [
      "Music Box",
      "Wind-Up Toy",
      "Slinky"
    ]
  },
  {
    "id": "ENT-TOY-007",
    "domain_id": "toys_playground",
    "subtopic_id": "classic_toys",
    "name": "Rocking Horse",
    "language": "en",
    "audience_rating": "kids",
    "aliases": [
      "Rocking Pony"
    ],
    "difficulty": 1,
    "visual_anchor": "A dapple-gray wooden rocking horse with a red saddle and flowing mane in a sunny playroom, toys scattered on a rug, 9:16 vertical shot.",
    "core_traits": [
      "Toy animal a child can sit on and ride",